{
	"output": [
		{
			"type": "webhook",
			"webhook": {
				"url": "http://localhost:8081/vm/webhook"
			}
		}
	],
	"monitor": {
		"interval": 10,
		"filters": {
			"whitelist": [
				"go"
			],
			"users": [
				"alessandro"
			]
		}
	},
	"server": {
		"port": 8080
	},
	"advanced": {
		"debug": true,
		"omitScanning": [
			"processs.command",
			"process.user"
		]
	}
}