{
	"output": [
		{
			"type": "file",
			"file": {
				"path": "./eventsFile/file.log"
			}
		}
	],
	"monitor": {
		"interval": 30,
		"filters": {
			"whitelist": [
				"go"
			],
			"users": [
				"alessandro"
			]
		}
	},
	"server": {
		"port": 8080
	},
	"advanced": {
		"debug": true,
		"omitScanning": [
			"process.command",
			"process.user"
		]
	}
}